{
  "$schema": "https://json-schema.org/draft/2020-12/schema",
  "$id": "https://videoagent.local/contracts/canvas-v1/workspace-materialization.schema.json",
  "title": "Canvas V1 Workspace and Asset Materialization additive transports",
  "type": "object",
  "additionalProperties": false,
  "$defs": {
    "uuid": {
      "type": "string",
      "pattern": "^[0-9a-f]{8}-[0-9a-f]{4}-[1-5][0-9a-f]{3}-[89ab][0-9a-f]{3}-[0-9a-f]{12}$"
    },
    "timestamp": {
      "type": "string",
      "pattern": "^\\d{4}-\\d{2}-\\d{2}T\\d{2}:\\d{2}:\\d{2}\\.\\d{3}Z$",
      "format": "date-time"
    },
    "requestId": {
      "type": "string",
      "pattern": "^[A-Za-z0-9._:-]{1,128}$"
    },
    "canvasSessionId": {
      "type": "string",
      "pattern": "^pcs_[A-Za-z0-9_-]{24,128}$"
    },
    "digest": {
      "type": "string",
      "pattern": "^sha256:[a-f0-9]{64}$"
    },
    "controlledMediaUrl": {
      "type": ["string", "null"],
      "maxLength": 2048,
      "pattern": "^/(?:api/canvas-v1|api/production/pilot/canvas/v1/media)/[A-Za-z0-9_./%-]+$"
    },
    "workspaceReasonCode": {
      "enum": [
        "WORKSPACE_CAPABILITY_BLOCKED",
        "WORKSPACE_SHOT_BLOCKED",
        "WORKSPACE_ASSET_AGGREGATE_INCOMPLETE",
        "WORKSPACE_REQUIREMENTS_INCOMPLETE",
        "WORKSPACE_READINESS_INCOMPLETE",
        "WORKSPACE_OUTPUTS_INCOMPLETE",
        "WORKSPACE_EVENTS_INCOMPLETE",
        "WORKSPACE_CONTROLLED_MEDIA_INCOMPLETE"
      ]
    },
    "materializationStatus": {
      "enum": ["not_started", "ready", "blocked", "unsupported"]
    },
    "materializationReasonCode": {
      "enum": [
        "MATERIALIZATION_REQUIRED",
        "RIGHTS_NOT_AUTHORIZED",
        "APPROVAL_NOT_APPROVED",
        "SOURCE_UNAVAILABLE",
        "MATERIALIZATION_CONFLICT",
        "CATEGORY_UNSUPPORTED"
      ]
    },
    "safeAssetAggregate": {
      "type": "object",
      "additionalProperties": false,
      "required": [
        "assetId",
        "category",
        "displayName",
        "rightsStatus",
        "approvalStatus",
        "providerStatus",
        "entityBindingStatus",
        "controlledPreviewUrl",
        "targetEntityId",
        "materialization"
      ],
      "properties": {
        "assetId": { "$ref": "#/$defs/uuid" },
        "category": { "$ref": "canvas-v1.schema.json#/$defs/assetCategory" },
        "displayName": { "type": "string", "minLength": 1, "maxLength": 200 },
        "rightsStatus": { "$ref": "canvas-v1.schema.json#/$defs/rightsStatus" },
        "approvalStatus": { "$ref": "canvas-v1.schema.json#/$defs/approvalStatus" },
        "providerStatus": { "$ref": "canvas-v1.schema.json#/$defs/providerStatus" },
        "entityBindingStatus": { "$ref": "canvas-v1.schema.json#/$defs/entityBindingStatus" },
        "controlledPreviewUrl": { "$ref": "#/$defs/controlledMediaUrl" },
        "targetEntityId": {
          "oneOf": [{ "$ref": "#/$defs/uuid" }, { "type": "null" }]
        },
        "materialization": {
          "type": "object",
          "additionalProperties": false,
          "required": ["status", "reasonCode"],
          "properties": {
            "status": { "$ref": "#/$defs/materializationStatus" },
            "reasonCode": {
              "oneOf": [{ "$ref": "#/$defs/materializationReasonCode" }, { "type": "null" }]
            }
          }
        }
      }
    },
    "controlledOutput": {
      "type": "object",
      "additionalProperties": false,
      "required": ["assetId", "kind", "previewUrl", "selected"],
      "properties": {
        "assetId": { "$ref": "#/$defs/uuid" },
        "kind": { "enum": ["image", "video"] },
        "previewUrl": {
          "type": "string",
          "maxLength": 2048,
          "pattern": "^/api/production/pilot/canvas/v1/media/[A-Za-z0-9_./%-]+$"
        },
        "selected": { "type": "boolean" }
      }
    },
    "shotView": {
      "type": "object",
      "additionalProperties": false,
      "required": [
        "shotId",
        "sequence",
        "title",
        "durationSeconds",
        "scriptText",
        "storyboardText",
        "thumbnailUrl",
        "requirements",
        "readiness",
        "requiredAssetLabels",
        "outputs",
        "event"
      ],
      "properties": {
        "shotId": { "$ref": "#/$defs/uuid" },
        "sequence": { "type": "integer", "minimum": 1 },
        "title": { "type": "string", "minLength": 1, "maxLength": 200 },
        "durationSeconds": { "type": "number", "exclusiveMinimum": 0, "maximum": 300 },
        "scriptText": { "type": "string", "minLength": 1, "maxLength": 50000 },
        "storyboardText": { "type": "string", "minLength": 1, "maxLength": 4000 },
        "thumbnailUrl": { "$ref": "#/$defs/controlledMediaUrl" },
        "requirements": {
          "type": "array",
          "minItems": 1,
          "maxItems": 1000,
          "items": { "$ref": "canvas-v1.schema.json#/$defs/shotAssetRequirement" }
        },
        "readiness": { "$ref": "canvas-v1.schema.json#/$defs/shotReadiness" },
        "requiredAssetLabels": {
          "type": "array",
          "minItems": 1,
          "maxItems": 1000,
          "uniqueItems": true,
          "items": { "type": "string", "minLength": 1, "maxLength": 40 }
        },
        "outputs": {
          "type": "array",
          "maxItems": 1000,
          "items": { "$ref": "#/$defs/controlledOutput" }
        },
        "event": {
          "oneOf": [
            { "$ref": "canvas-v1.schema.json#/$defs/canvasEvent" },
            { "type": "null" }
          ]
        }
      }
    },
    "canvasWorkspace": {
      "type": "object",
      "additionalProperties": false,
      "required": [
        "objectType",
        "contractVersion",
        "tenantId",
        "projectId",
        "packageId",
        "canvasSessionId",
        "status",
        "reasonCodes",
        "completeness",
        "project",
        "bootstrap",
        "document",
        "shots",
        "assets",
        "saveState",
        "requestId",
        "occurredAt"
      ],
      "properties": {
        "objectType": { "const": "CanvasWorkspace" },
        "contractVersion": { "const": "0.1" },
        "tenantId": { "$ref": "#/$defs/uuid" },
        "projectId": { "$ref": "#/$defs/uuid" },
        "packageId": { "$ref": "#/$defs/uuid" },
        "canvasSessionId": { "$ref": "#/$defs/canvasSessionId" },
        "status": { "enum": ["ready", "blocked"] },
        "reasonCodes": {
          "type": "array",
          "uniqueItems": true,
          "items": { "$ref": "#/$defs/workspaceReasonCode" }
        },
        "completeness": {
          "type": "object",
          "additionalProperties": false,
          "required": ["assets", "requirements", "readiness", "outputs", "events", "controlledMedia"],
          "properties": {
            "assets": { "type": "boolean" },
            "requirements": { "type": "boolean" },
            "readiness": { "type": "boolean" },
            "outputs": { "type": "boolean" },
            "events": { "type": "boolean" },
            "controlledMedia": { "type": "boolean" }
          }
        },
        "project": {
          "type": "object",
          "additionalProperties": false,
          "required": ["projectName", "requestedByActorId"],
          "properties": {
            "projectName": { "type": "string", "minLength": 1, "maxLength": 200 },
            "requestedByActorId": { "$ref": "#/$defs/uuid" }
          }
        },
        "bootstrap": { "$ref": "canvas-v1.schema.json#/$defs/canvasBootstrap" },
        "document": { "$ref": "canvas-v1.schema.json#/$defs/canvasDocument" },
        "shots": {
          "type": "array",
          "minItems": 1,
          "maxItems": 1000,
          "items": { "$ref": "#/$defs/shotView" }
        },
        "assets": {
          "type": "array",
          "maxItems": 1000,
          "items": { "$ref": "#/$defs/safeAssetAggregate" }
        },
        "saveState": { "const": "saved" },
        "requestId": { "$ref": "#/$defs/requestId" },
        "occurredAt": { "$ref": "#/$defs/timestamp" }
      }
    },
    "materializationRequest": {
      "type": "object",
      "additionalProperties": false,
      "required": [
        "objectType",
        "contractVersion",
        "tenantId",
        "projectId",
        "packageId",
        "canvasSessionId",
        "assetId",
        "actorId",
        "materializationAttemptId",
        "requestId",
        "occurredAt"
      ],
      "properties": {
        "objectType": { "const": "CanvasAssetMaterializationRequest" },
        "contractVersion": { "const": "0.1" },
        "tenantId": { "$ref": "#/$defs/uuid" },
        "projectId": { "$ref": "#/$defs/uuid" },
        "packageId": { "$ref": "#/$defs/uuid" },
        "canvasSessionId": { "$ref": "#/$defs/canvasSessionId" },
        "assetId": { "$ref": "#/$defs/uuid" },
        "actorId": { "$ref": "#/$defs/uuid" },
        "materializationAttemptId": { "$ref": "#/$defs/uuid" },
        "requestId": { "$ref": "#/$defs/requestId" },
        "occurredAt": { "$ref": "#/$defs/timestamp" }
      }
    },
    "materializationResponse": {
      "type": "object",
      "additionalProperties": false,
      "required": [
        "objectType",
        "contractVersion",
        "tenantId",
        "projectId",
        "packageId",
        "canvasSessionId",
        "assetId",
        "materializationAttemptId",
        "materializationId",
        "category",
        "mimeType",
        "byteSize",
        "checksum",
        "contentEncoding",
        "contentBase64",
        "replayed",
        "requestId",
        "occurredAt"
      ],
      "properties": {
        "objectType": { "const": "CanvasAssetMaterialization" },
        "contractVersion": { "const": "0.1" },
        "tenantId": { "$ref": "#/$defs/uuid" },
        "projectId": { "$ref": "#/$defs/uuid" },
        "packageId": { "$ref": "#/$defs/uuid" },
        "canvasSessionId": { "$ref": "#/$defs/canvasSessionId" },
        "assetId": { "$ref": "#/$defs/uuid" },
        "materializationAttemptId": { "$ref": "#/$defs/uuid" },
        "materializationId": { "$ref": "#/$defs/uuid" },
        "category": { "const": "virtual_character" },
        "mimeType": { "enum": ["image/jpeg", "image/png", "image/webp"] },
        "byteSize": { "type": "integer", "minimum": 1, "maximum": 8388608 },
        "checksum": { "$ref": "#/$defs/digest" },
        "contentEncoding": { "const": "base64" },
        "contentBase64": {
          "type": "string",
          "minLength": 4,
          "maxLength": 11184812,
          "pattern": "^(?:[A-Za-z0-9+/]{4})*(?:[A-Za-z0-9+/]{2}==|[A-Za-z0-9+/]{3}=)?$"
        },
        "replayed": { "type": "boolean" },
        "requestId": { "$ref": "#/$defs/requestId" },
        "occurredAt": { "$ref": "#/$defs/timestamp" }
      }
    },
    "materializationErrorCode": {
      "enum": [
        "CANVAS_MATERIALIZATION_INTERNAL_AUTH_INVALID",
        "CANVAS_MATERIALIZATION_REQUEST_INVALID",
        "CANVAS_MATERIALIZATION_REQUEST_TOO_LARGE",
        "CANVAS_MATERIALIZATION_SESSION_INVALID",
        "CANVAS_MATERIALIZATION_SCOPE_MISMATCH",
        "CANVAS_MATERIALIZATION_ASSET_NOT_FOUND",
        "CANVAS_MATERIALIZATION_RIGHTS_NOT_AUTHORIZED",
        "CANVAS_MATERIALIZATION_ASSET_NOT_APPROVED",
        "CANVAS_MATERIALIZATION_CATEGORY_UNSUPPORTED",
        "CANVAS_MATERIALIZATION_SOURCE_UNAVAILABLE",
        "CANVAS_MATERIALIZATION_SOURCE_EMPTY",
        "CANVAS_MATERIALIZATION_SOURCE_TOO_LARGE",
        "CANVAS_MATERIALIZATION_MIME_UNSUPPORTED",
        "CANVAS_MATERIALIZATION_CONTENT_INTEGRITY_FAILED",
        "CANVAS_MATERIALIZATION_IDEMPOTENCY_CONFLICT",
        "CANVAS_MATERIALIZATION_DEPENDENCY_UNAVAILABLE"
      ]
    },
    "materializationError": {
      "type": "object",
      "additionalProperties": false,
      "required": ["error"],
      "properties": {
        "error": {
          "type": "object",
          "additionalProperties": false,
          "required": ["code", "message", "retryable", "requestId"],
          "properties": {
            "code": { "$ref": "#/$defs/materializationErrorCode" },
            "message": { "type": "string", "minLength": 1, "maxLength": 160 },
            "retryable": { "type": "boolean" },
            "requestId": { "$ref": "#/$defs/requestId" }
          }
        }
      }
    }
  },
  "required": [
    "workspaceResponse",
    "materializationRequest",
    "materializationResponse",
    "materializationError"
  ],
  "properties": {
    "workspaceResponse": { "$ref": "#/$defs/canvasWorkspace" },
    "materializationRequest": { "$ref": "#/$defs/materializationRequest" },
    "materializationResponse": { "$ref": "#/$defs/materializationResponse" },
    "materializationError": { "$ref": "#/$defs/materializationError" }
  }
}
